{
  "trace_id": "echo.trace.sample.v1",
  "agent_did": "did:echo:agent.sample.1",
  "domain_embedding": "VEC_DOMAIN_001",
  "activity_type": "PUBLISH_EO",
  "refs": ["echo.eo.sample.v1"],
  "created_at": "2026-02-14T00:05:00Z",
  "ttl_seconds": 3600,
  "protocol": "ECHO/1.0",
  "signature": "TEST_SIGNATURE"
}
